{
  "artifact": "TFII_CDM_Record_Integrity_Profile_001",
  "version": "1.0.0",
  "as_of": "2026-07-16",
  "target_cdm_revision": "a6ffe777bc12ef3d289579cb3a86d1cbffea63d2",
  "source_sample_sha256": "a00b47432e36e26436a327d138070bc0cb139e0fa417afa47bbb947f687553ef",
  "profile_rule": "Native CDM mechanics are retained. TFII profile fields preserve financial-record authority, evidence state, Unknowns, rights, coverage and the fail-closed precondition before collateral eligibility is queried.",
  "requirements": [
    {
      "requirement_id": "TFII-CDM-001",
      "tfii_field": "financial_object",
      "native_cdm_status": "PASS",
      "profile_field": "financial_object.security",
      "combined_status": "PASS"
    },
    {
      "requirement_id": "TFII-CDM-002",
      "tfii_field": "record_keeper",
      "native_cdm_status": "PASS",
      "profile_field": "record_integrity.record_keeper",
      "combined_status": "PASS"
    },
    {
      "requirement_id": "TFII-CDM-003",
      "tfii_field": "transfer_flow",
      "native_cdm_status": "PASS",
      "profile_field": "cdm_native.TransferBase",
      "combined_status": "PASS"
    },
    {
      "requirement_id": "TFII-CDM-004",
      "tfii_field": "transfer_status",
      "native_cdm_status": "PASS",
      "profile_field": "cdm_native.TransferStatusEnum",
      "combined_status": "PASS"
    },
    {
      "requirement_id": "TFII-CDM-005",
      "tfii_field": "valuation_clock",
      "native_cdm_status": "PARTIAL",
      "profile_field": "record_integrity.valuation_authority",
      "combined_status": "PASS"
    },
    {
      "requirement_id": "TFII-CDM-006",
      "tfii_field": "correction_lineage",
      "native_cdm_status": "PARTIAL",
      "profile_field": "record_integrity.correction_lineage",
      "combined_status": "PASS"
    },
    {
      "requirement_id": "TFII-CDM-007",
      "tfii_field": "collateral_schedule",
      "native_cdm_status": "PASS",
      "profile_field": "cdm_native.EligibleCollateralSpecification",
      "combined_status": "PASS"
    },
    {
      "requirement_id": "TFII-CDM-008",
      "tfii_field": "authoritative_record",
      "native_cdm_status": "FAIL",
      "profile_field": "record_integrity.authoritative_record",
      "combined_status": "PASS"
    },
    {
      "requirement_id": "TFII-CDM-009",
      "tfii_field": "chain_role",
      "native_cdm_status": "FAIL",
      "profile_field": "record_integrity.token_role",
      "combined_status": "PASS"
    },
    {
      "requirement_id": "TFII-CDM-010",
      "tfii_field": "transfer_effective_event",
      "native_cdm_status": "FAIL",
      "profile_field": "record_integrity.ownership_effective_event",
      "combined_status": "PASS"
    },
    {
      "requirement_id": "TFII-CDM-011",
      "tfii_field": "correction_hierarchy",
      "native_cdm_status": "FAIL",
      "profile_field": "record_integrity.correction_authority",
      "combined_status": "PASS"
    },
    {
      "requirement_id": "TFII-CDM-012",
      "tfii_field": "reconciliation",
      "native_cdm_status": "FAIL",
      "profile_field": "record_integrity.reconciliation",
      "combined_status": "PASS"
    },
    {
      "requirement_id": "TFII-CDM-013",
      "tfii_field": "wallet_eligibility",
      "native_cdm_status": "FAIL",
      "profile_field": "record_integrity.wallet_eligibility",
      "combined_status": "PASS"
    },
    {
      "requirement_id": "TFII-CDM-014",
      "tfii_field": "evidence_metadata_and_unknowns",
      "native_cdm_status": "FAIL",
      "profile_field": "evidence_assertions",
      "combined_status": "PASS"
    },
    {
      "requirement_id": "TFII-CDM-015",
      "tfii_field": "rights_state",
      "native_cdm_status": "FAIL",
      "profile_field": "record_integrity.rights_state",
      "combined_status": "PASS"
    },
    {
      "requirement_id": "TFII-CDM-016",
      "tfii_field": "coverage_scope_and_freshness",
      "native_cdm_status": "FAIL",
      "profile_field": "coverage",
      "combined_status": "PASS"
    },
    {
      "requirement_id": "TFII-CDM-017",
      "tfii_field": "integrity_gated_collateral_eligibility",
      "native_cdm_status": "PARTIAL",
      "profile_field": "collateral_gate",
      "combined_status": "PASS"
    }
  ],
  "records": [
    {
      "record_id": "FET-TFII-001",
      "instrument_name": "Franklin OnChain U.S. Government Money Fund",
      "architecture_class": "TRANSFER_AGENT_BLOCKCHAIN_INTEGRATED_OFFICIAL_RECORD",
      "financial_object": {
        "cdm_asset_class": "Security",
        "security_type": "FundShare",
        "source_record_id": "FET-TFII-001"
      },
      "record_integrity": {
        "record_keeper": {
          "value": "Transfer agent",
          "evidence_state": "OBSERVATION",
          "source_ids": [
            "EA-FUND-005"
          ],
          "source_locator": "CONTROLLED_SOURCE_RECEIPT#locator-1",
          "confidence": "High",
          "notes": "Named transfer-agent entity remains to be extracted."
        },
        "authoritative_record": {
          "value": "Transfer-agent-maintained official ownership record across approved blockchain networks.",
          "evidence_state": "OBSERVATION",
          "source_ids": [
            "EA-FUND-005"
          ],
          "source_locator": "CONTROLLED_SOURCE_RECEIPT#locator-1",
          "confidence": "High",
          "notes": "The receipt binds the filing's stated official-record architecture; legal effect is outside scope."
        },
        "token_role": {
          "value": "Integrated component of the official transfer-agent record.",
          "evidence_state": "OBSERVATION",
          "source_ids": [
            "EA-FUND-005"
          ],
          "source_locator": "CONTROLLED_SOURCE_RECEIPT#locator-1",
          "confidence": "High",
          "notes": "Approved-network treatment may differ by network and filing version."
        },
        "ownership_effective_event": {
          "value": "Transaction confirmation on the relevant approved blockchain after transfer-agent processing.",
          "evidence_state": "OBSERVATION",
          "source_ids": [
            "EA-FUND-005"
          ],
          "source_locator": "CONTROLLED_SOURCE_RECEIPT#locator-3",
          "confidence": "High",
          "notes": "This timing is filing-specific and must not be generalized to other tokenized shares."
        },
        "valuation_authority": {
          "value": null,
          "evidence_state": "UNKNOWN",
          "source_ids": [],
          "source_locator": null,
          "confidence": "Unknown",
          "notes": "The collateral workflow's accepted valuation authority is not public"
        },
        "correction_authority": {
          "value": "Transfer agent has correction control over erroneous or unauthorized blockchain-recorded activity.",
          "evidence_state": "OBSERVATION",
          "source_ids": [
            "EA-FUND-005"
          ],
          "source_locator": "CONTROLLED_SOURCE_RECEIPT#locator-2",
          "confidence": "High",
          "notes": "Exact correction mechanics and downstream propagation remain incomplete."
        },
        "correction_lineage": {
          "value": null,
          "evidence_state": "UNKNOWN",
          "source_ids": [],
          "source_locator": null,
          "confidence": "Unknown",
          "notes": "No live correction event or downstream propagation receipt is in the public sample"
        },
        "reconciliation": {
          "value": null,
          "evidence_state": "UNKNOWN",
          "source_ids": [],
          "source_locator": null,
          "confidence": "Unknown",
          "notes": "Private reconciliation workpapers and exception state are unavailable"
        },
        "wallet_eligibility": {
          "value": null,
          "evidence_state": "UNKNOWN",
          "source_ids": [],
          "source_locator": null,
          "confidence": "Unknown",
          "notes": "Receiver-specific wallet and holder eligibility are unavailable"
        },
        "rights_state": {
          "value": "SEC website policy permits copying and further distribution of public sec.gov information without separate SEC permission. TFII may cite, transform, display, and distribute bounded EDGAR-derived factual records with attribution and without implying SEC or issuer endorsement; private records, third-party data, and trademark use remain outside this basis.",
          "evidence_state": "BOUNDED_INTERPRETATION",
          "source_ids": [
            "EA-FUND-005",
            "EA-RIGHTS-003"
          ],
          "source_locator": "CONTROLLED_SOURCE_RECEIPT#locator-1 and the registered EDGAR filing receipt.",
          "confidence": "High",
          "notes": "This bounded source-use basis is not an issuer endorsement, trademark licence, private-data right, or jurisdiction-wide legal opinion."
        }
      },
      "evidence_assertions": {
        "authoritative_record": {
          "value": "Transfer-agent-maintained official ownership record across approved blockchain networks.",
          "evidence_state": "OBSERVATION",
          "source_ids": [
            "EA-FUND-005"
          ],
          "source_locator": "CONTROLLED_SOURCE_RECEIPT#locator-1",
          "confidence": "High",
          "notes": "The receipt binds the filing's stated official-record architecture; legal effect is outside scope."
        },
        "chain_role": {
          "value": "Integrated component of the official transfer-agent record.",
          "evidence_state": "OBSERVATION",
          "source_ids": [
            "EA-FUND-005"
          ],
          "source_locator": "CONTROLLED_SOURCE_RECEIPT#locator-1",
          "confidence": "High",
          "notes": "Approved-network treatment may differ by network and filing version."
        },
        "transfer_effective_event": {
          "value": "Transaction confirmation on the relevant approved blockchain after transfer-agent processing.",